<?xml version="1.0"?>
<!DOCTYPE ggobidata SYSTEM "ggobi.dtd">

<ggobidata>
<data name="SAT scores">
<description>
</description>
<variables count="10">
 <variable>STATE</variable>
 <variable>SAT</variable>
 <variable>EXPEND</variable>
 <variable>PERPUPIL</variable>
 <variable>ENROLL</variable>
 <variable>TEACHERS</variable>
 <variable>RATIO</variable>
 <variable>SALARY</variable>
 <variable>ATTEND</variable>
 <variable>COMPUTER</variable>
</variables>
<records count="51">
<record label="Alabama" color="0" glyph="fc 3">
1.000 1022.000 2188020.000 3197.000 724751.000 38845.000 18.700 25190.000 684453.000 28353.000
</record>
<record label="Alaska" color="0" glyph="fc 3">
2.000 923.000 739020.000 7716.000 106481.000 6272.000 17.000 41754.000 95776.000 8806.000
</record>
<record label="Arizona" color="0" glyph="fc 3">
3.000 853.000 2143148.000 3902.000 574890.000 31617.000 18.200 28499.000 549219.000 31676.000
</record>
<record label="Arkansas" color="0" glyph="fc 3">
4.000 986.000 1319370.000 3272.000 436387.000 27730.000 15.700 21395.000 403106.000 17734.000
</record>
<record label="California" color="0" glyph="fc 3">
5.000 906.000 19370242.000 4121.000 4618120.000 203342.000 22.700 34684.000 4699865.000 186468.000
</record>
<record label="Colorado" color="0" glyph="fc 3">
6.000 966.000 2266667.000 4408.000 560081.000 31398.000 17.800 29558.000 514232.000 32212.000
</record>
<record label="Connecticut" color="0" glyph="fc 3">
7.000 908.000 2984542.000 6857.000 460637.000 35502.000 13.000 37343.000 435227.000 21188.000
</record>
<record label="WashingonDC" color="0" glyph="fc 3">
8.000 903.000 479327.000 5422.000 96678.000 5898.000 16.400 31585.000 88397.000 3328.000
</record>
<record label="Delaware" color="0" glyph="fc 3">
9.000 846.000 584035.000 7850.000 84792.000 5936.000 14.300 36290.000 74398.000 3695.000
</record>
<record label="Florida" color="0" glyph="fc 3">
10.000 887.000 7245515.000 4563.000 1720930.000 100370.000 17.100 26974.000 1587882.000 86267.000
</record>
<record label="Georgia" color="0" glyph="fc 3">
11.000 847.000 4006069.000 3852.000 1107994.000 59916.000 18.500 26920.000 1039977.000 45715.000
</record>
<record label="Hawaii" color="0" glyph="fc 3">
12.000 888.000 643319.000 4121.000 167488.000 8737.000 19.200 30778.000 156114.000 4621.000
</record>
<record label="Idaho" color="0" glyph="fc 3">
13.000 965.000 571159.000 2838.000 214615.000 10425.000 20.600 22734.000 201219.000 8442.000
</record>
<record label="Illinois" color="0" glyph="fc 3">
14.000 982.000 7655153.000 4906.000 1794916.000 105097.000 17.100 31145.000 1560461.000 66679.000
</record>
<record label="Indiana" color="0" glyph="fc 3">
15.000 871.000 3779468.000 4284.000 960994.000 54029.000 17.800 29331.000 882175.000 45439.000
</record>
<record label="Iowa" color="0" glyph="fc 3">
16.000 1084.000 1925623.000 4285.000 478200.000 30327.000 15.800 25778.000 449418.000 25340.000
</record>
<record label="Kansas" color="0" glyph="fc 3">
17.000 1040.000 1712260.000 4443.000 426596.000 28122.000 15.200 27360.000 385364.000 21653.000
</record>
<record label="Kentucky" color="0" glyph="fc 3">
18.000 996.000 1918741.000 3347.000 637627.000 35788.000 17.800 24930.000 573221.000 27125.000
</record>
<record label="Louisiana" color="0" glyph="fc 3">
19.000 986.000 2468307.000 3317.000 786683.000 43203.000 18.200 22470.000 744142.000 27301.000
</record>
<record label="Maine" color="0" glyph="fc 3">
20.000 987.000 921931.000 4744.000 212902.000 14593.000 14.600 24938.000 194350.000 9126.000
</record>
<record label="Maryland" color="0" glyph="fc 3">
21.000 914.000 3505018.000 5758.000 688947.000 40899.000 16.800 33895.000 608699.000 33574.000
</record>
<record label="Massachusetts" color="0" glyph="fc 3">
22.000 905.000 4522119.000 5979.000 823428.000 60068.000 13.700 32221.000 756285.000 40731.000
</record>
<record label="Michigan" color="0" glyph="fc 3">
23.000 972.000 7493266.000 5116.000 1582785.000 79847.000 19.800 34823.000 1464766.000 69821.000
</record>
<record label="Minnesota" color="0" glyph="fc 3">
24.000 1066.000 3282296.000 4755.000 726950.000 42750.000 17.000 30660.000 690266.000 59184.000
</record>
<record label="Mississippi" color="0" glyph="fc 3">
25.000 988.000 1372290.000 2874.000 503326.000 27283.000 18.400 22578.000 477439.000 10890.000
</record>
<record label="Missouri" color="0" glyph="fc 3">
26.000 989.000 3096666.000 4263.000 806639.000 50693.000 15.900 26006.000 726451.000 35121.000
</record>
<record label="Montana" color="0" glyph="fc 3">
27.000 992.000 592454.000 4293.000 152191.000 9626.000 15.800 24421.000 138016.000 9004.000
</record>
<record label="Nebraska" color="0" glyph="fc 3">
28.000 1030.000 1105009.000 4360.000 269434.000 18003.000 15.000 23845.000 253426.000 12785.000
</record>
<record label="Nevada" color="0" glyph="fc 3">
29.000 926.000 615161.000 3791.000 176474.000 8699.000 20.300 28840.000 162256.000 8446.000
</record>
<record label="NewHampshire" color="0" glyph="fc 3">
30.000 932.000 733230.000 4807.000 169413.000 10442.000 16.200 26702.000 152536.000 4484.000
</record>
<record label="NewJersey" color="0" glyph="fc 3">
31.000 894.000 7309147.000 7549.000 1080871.000 79698.000 13.600 33037.000 968176.000 52330.000
</record>
<record label="NewMexico" color="0" glyph="fc 3">
32.000 1015.000 975552.000 3437.000 292425.000 15770.000 18.500 23897.000 280921.000 19192.000
</record>
<record label="NewYork" color="0" glyph="fc 3">
33.000 890.000 17127584.000 7663.000 2573715.000 172807.000 14.900 36654.000 2234976.000 139032.000
</record>
<record label="NorthCarolina" color="0" glyph="fc 3">
34.000 836.000 3892971.000 3874.000 1083156.000 61933.000 17.500 25738.000 1004837.000 64245.000
</record>
<record label="NorthDakota" color="0" glyph="fc 3">
35.000 1067.000 431814.000 3952.000 118809.000 7731.000 15.400 22249.000 109271.000 5537.000
</record>
<record label="Ohio" color="0" glyph="fc 3">
36.000 948.000 7425194.000 4649.000 1778544.000 101021.000 17.600 29671.000 1597117.000 72839.000
</record>
<record label="Oklahoma" color="0" glyph="fc 3">
37.000 1001.000 1822743.000 3379.000 580426.000 35116.000 16.500 22370.000 542693.000 25762.000
</record>
<record label="Oregon" color="0" glyph="fc 3">
38.000 927.000 2123241.000 5182.000 461752.000 25147.000 18.400 29390.000 409717.000 23961.000
</record>
<record label="Pennsylvania" color="0" glyph="fc 3">
39.000 886.000 8597355.000 5609.000 1659714.000 104379.000 15.900 31248.000 1532806.000 6994.000
</record>
<record label="RhodeIsland" color="0" glyph="fc 3">
40.000 895.000 736942.000 5976.000 133585.000 9216.000 14.500 34233.000 123321.000 4903.000
</record>
<record label="SouthCarolina" color="0" glyph="fc 3">
41.000 838.000 2118732.000 3736.000 615774.000 35877.000 17.200 25623.000 567133.000 30784.000
</record>
<record label="SouthDakota" color="0" glyph="fc 3">
42.000 1041.000 427522.000 3581.000 126910.000 8260.000 15.400 20530.000 119400.000 9378.000
</record>
<record label="Tennessee" color="0" glyph="fc 3">
43.000 1009.000 2668341.000 3491.000 821580.000 42657.000 19.300 25619.000 764354.000 29817.000
</record>
<record label="Texas" color="0" glyph="fc 3">
44.000 877.000 11761447.000 3877.000 3283707.000 196616.000 16.700 26527.000 3033684.000 152835.000
</record>
<record label="Utah" color="0" glyph="fc 3">
45.000 1036.000 1040104.000 2579.000 43119.000 17602.000 24.500 22852.000 403294.000 18776.000
</record>
<record label="Vermont" color="0" glyph="fc 3">
46.000 905.000 485226.000 5481.000 93381.000 6852.000 13.600 27092.000 88532.000 3147.000
</record>
<record label="Virginia" color="0" glyph="fc 3">
47.000 902.000 4151050.000 4539.000 982393.000 60883.000 16.100 28967.000 914445.000 52214.000
</record>
<record label="Washington" color="0" glyph="fc 3">
48.000 939.000 3204265.000 4352.000 790918.000 38780.000 20.400 29199.000 736345.000 41840.000
</record>
<record label="WestVirginia" color="0" glyph="fc 3">
49.000 939.000 1202486.000 3883.000 335912.000 22177.000 15.100 21904.000 309691.000 17170.000
</record>
<record label="Wisconsin" color="0" glyph="fc 3">
50.000 1013.000 3688311.000 5266.000 774857.000 48541.000 16.000 30779.000 700389.000 39970.000
</record>
<record label="Wyoming" color="0" glyph="fc 3">
51.000 978.000 491930.000 5375.000 97793.000 6693.000 14.600 27685.000 91515.000 7566.000
</record>
</records>
</data>
</ggobidata>
