<?xml version="1.0"?>
<!DOCTYPE colormap SYSTEM "ggobi.dtd">

<colormap size="10">
 <color>1.00 0.08 0.58 </color>
 <color>1.00 1.0 0.00  </color>
 <color>0.00 0.00 1.00 </color>
 <color>0.0  1.0  0.00 </color>
 <color>1.00 0.00 0.00 </color>
 <color>0.00 0.75 1.00 </color>
 <color>1.0  0.0 1.00  </color>
 <color>0.00 0.80 0.20 </color>
 <color>0.00 0.98 0.60 </color>
 <color>0.73 0.33 0.83 </color>
</colormap>
