<?xml version="1.0"?>
<!DOCTYPE ggobidata SYSTEM "ggobi.dtd">

<ggobidata numRecords="74" color="2" glyph="fc 3" missingValue="NA">
<description source="ftp://...">
This data is from a paper by A. A. Lubischew, "On the Use of
Discriminant Functions in Taxonomy", Biometrics, Dec 1962, pp.455-477.

There are three species of flea-beetles: Ch. concinna, Ch. heptapotamica,
and Ch. heikertingeri, and 6 measurements on each.
    1 =  width of the first joint of the first tarsus in microns 
        (the sum of measurements for both tarsi).
    2 = the same for the second joint.
    3 = the maximal width of the head between the external edges of the
        eyes in 0.01 mm.
    4 = the maximal width of the aedeagus in the fore-part in microns.
    5 = the front angle of the aedeagus ( 1 unit = 7.5 degrees).
    6 = the aedeagus width from the side in microns.
</description>
<colormap  file="stdColorMap.xml" type="xml" size="4">
<color>1 0 0 </color>
<color>0 1 0 </color>
<color>0 0 1</color>
<color id="4" r=".5" g=".5" b="0" />
</colormap>
<variables count="6">
  <variable>tars1</variable>
  <variable>tars2</variable>
  <variable>head</variable>
  <variable>aede1</variable>
  <variable>aede2</variable>
  <variable>aede3</variable>
</variables>
<records>
<record label="Concinna" color="2">
191 131 53 150 15 104
</record>
<record id="temp" label="Concinna" color="2">
185 134 50 147 13 105
</record>
<record label="Concinna" color="2">
200 137 52 144 14 102
</record>
<record label="Concinna" color="2">
173 127 50 144 16 97
</record>
<record label="Concinna" color="2">
171 118 49 153 13 106
</record>
<record label="Concinna" color="2">
160 118 47 140 15 99
</record>
<record label="Concinna" color="2">
188 134 54 151 14 98
</record>
<record label="Concinna" color="2">
186 129 51 143 14 110
</record>
<record label="Concinna" color="2">
174 131 52 144 14 116
</record>
<record label="Concinna" color="2">
163 115 47 142 15 95
</record>
<record label="Concinna" color="2">
190 143 52 141 13 99
</record>
<record label="Concinna" color="2">
174 131 50 150 15 105
</record>
<record label="Concinna" color="2">
201 130 51 148 13 110
</record>
<record label="Concinna" color="2">
190 133 53 154 15 106
</record>
<record label="Concinna" color="2">
182 130 51 147 14 105
</record>
<record label="Concinna" color="2">
184 131 51 137 14 95
</record>
<record label="Concinna" color="2">
177 127 49 134 15 105
</record>
<record label="Concinna" color="2">
178 126 53 157 14 116
</record>
<record label="Concinna" color="2">
210 140 54 149 13 107
</record>
<record label="Concinna" color="2">
182 121 51 147 13 111
</record>
<record label="Concinna" color="2">
186 136 56 148 14 111
</record>
<record label="Heptapot.">
158 141 58 145 8 107
</record>
<record label="Heptapot." color="4">
146 119 51 140 11 111
</record>
<record label="Heptapot." color="4">
151 130 51 140 11 113
</record>
<record label="Heptapot." color="4">
122 113 45 131 10 102
</record>
<record label="Heptapot." color="4">
138 121 53 139 11 106
</record>
<record label="Heptapot." color="4">
132 115 49 139 10 98
</record>
<record label="Heptapot." color="4">
131 127 51 136 12 107
</record>
<record label="Heptapot." color="4">
135 123 50 129 11 107
</record>
<record label="Heptapot." color="4">
125 119 51 140 10 110
</record>
<record label="Heptapot." color="4">
130 120 48 137 9 106
</record>
<record label="Heptapot." color="4">
130 131 51 141 11 108
</record>
<record label="Heptapot." color="4">
138 127 52 138 9 101
</record>
<record label="Heptapot." color="4">
130 116 52 143 9 111
</record>
<record label="Heptapot." color="4">
143 123 54 142 11 95
</record>
<record label="Heptapot." color="4">
154 135 56 144 10 123
</record>
<record label="Heptapot." color="4">
147 132 54 138 10 102
</record>
<record label="Heptapot." color="4">
141 131 51 140 10 106
</record>
<record label="Heptapot." color="4">
131 116 47 130 9 102
</record>
<record label="Heptapot." color="4">
144 121 53 137 11 104
</record>
<record  label="Heptapot." color="4">
137 146 53 137 10 113
</record>
<record label="Heptapot." color="4">
143 119 53 136 9 105
</record>
<record label="Heptapot." color="4">
135 127 52 140 10 108
</record>
<record label="Heikert." color="7">
186 107 49 120 14 84
</record>
<record label="Heikert." color="7">
211 122 49 123 16 95
</record>
<record label="Heikert." color="7">
201 114 47 130 14 74
</record>
<record label="Heikert." color="7">
242 131 54 131 16 90
</record>
<record label="Heikert." color="7">
184 108 43 116 16 75
</record>
<record label="Heikert." color="7">
211 118 51 122 15 90
</record>
<record label="Heikert." color="7">
217 122 49 127 15 73
</record>
<record label="Heikert." color="7">
223 127 51 132 16 84
</record>
<record label="Heikert." color="7">
208 125 50 125 14 88
</record>
<record label="Heikert." color="7">
199 124 46 119 13 78
</record>
<record label="Heikert." color="7">
211 129 49 122 13 83
</record>
<record label="Heikert." color="7">
218 126 49 120 15 85
</record>
<record label="Heikert." color="7">
203 122 49 119 14 73
</record>
<record label="Heikert." color="7">
192 116 49 123 15 90
</record>
<record label="Heikert." color="7">
195 123 47 125 15 77
</record>
<record label="Heikert." color="7">
211 122 48 125 14 73
</record>
<record label="Heikert." color="7">
187 123 47 129 14 75
</record>
<record label="Heikert." color="7">
192 109 46 130 13 90
</record>
<record label="Heikert." color="7">
223 124 53 129 13 82
</record>
<record label="Heikert." color="7">
188 114 48 122 12 74
</record>
<record label="Heikert." color="7">
216 120 50 129 15 86
</record>
<record label="Heikert." color="7">
185 114 46 124 15 92
</record>
<record label="Heikert." color="7">
178 119 47 120 13 78
</record>
<record label="Heikert." color="7">
187 111 49 119 16 66
</record>
<record label="Heikert." color="7">
187 112 49 119 14 55
</record>
<record label="Heikert." color="7">
201 130 54 133 13 84
</record>
<record label="Heikert." color="7">
187 120 47 121 15 86
</record>
<record label="Heikert." color="7">
210 119 50 128 14 68
</record>
<record label="Heikert." color="7">
196 114 51 129 14 86
</record>
<record label="Heikert." color="7">
195 110 49 124 13 89
</record>
<record label="Heikert." color="7">
187 124 49 129 14 88
</record>
</records>
</ggobidata>
